登場人物,セリフ,備考,番号,返信先
女性D,一回、堺に蟄居させられたあと京に呼び戻されて切腹や。許す気あったんかと思いきや、結局アウトにするとか怖いわ,スレ⑤,19,
男性E,切腹したのは天正十九年、西暦やと1591年やな。享年70やから、この時代やと大往生の部類やけどな,スレ⑤,20,
男性A下,大徳寺山門の利休像をくぐった秀吉が激怒して詰めた、って話やなかったっけ？,スレ⑤,21,
女性B下大,公家の日記には、木像が一条戻橋にさらし者にされて騒然となった記述はあるけど、秀吉が山門をくぐって激怒した云々の記述はないんやで,スレ⑤,22,>>21
男性C,年を取って気が短くなった晩年の秀吉に、口出ししたのが悪かったんや,スレ⑤,23,
女性D大,当時の公家の日記やと利休は逐電になってるし、秀吉の自筆書状でも名護屋城で利休の茶で食事したとある。だから実は切腹してへん、というのが最近の学説やで,スレ⑤,24,
男性E下,ほんまか、全然知らんかったわ,スレ⑤,25,>>24
男性A下,NHKでも、実は秀吉に追い出されただけで切腹じゃなかったとか言ってたな,スレ⑤,26,>>24
女性B,子孫が表千家・裏千家・武者小路千家の三千家やぞ。切腹させられた割に、茶道は今も日本一デカい流派や,スレ⑤,27,
男性C,千利休って要は商人、しかも政商やからな。生臭いことこの上ないと思うんやが,スレ⑤,28,
女性D,辞世の句も残してるんやろ？「人生七十、力囲希咄」とかいうやつ,スレ⑤,29,
男性E,最期まで茶人ムーブ崩さんのは、まあ大したもんやけどな,スレ⑤,30,
男性A,最期の瞬間まで、全く取り乱さんかったらしいしな,スレ⑤,31,
女性B,いや格とか関係なく、ただ邪魔になったから消しただけやろ,スレ⑤,32,
男性C,茶聖とか持ち上げられすぎ。要は処世術が上手かっただけ説あるよな,スレ⑤,33,
女性D,それはさすがに過小評価やろ。茶の湯一個で時代の美意識まるごと変えとるんやぞ,スレ⑤,34,>>33
男性E,追放だけで済んだ説が本当なら、切腹の話は後世の脚色ってことになるんよな,スレ⑤,35,
男性A,江戸時代に利休が神格化されて、ドラマチックな切腹話が盛られた可能性はあるわな,スレ⑤,36,
女性B,ところで利休の子孫、今でも茶道で普通に食えとるらしいな。ええ商売やで,スレ⑤,37,
解説者,"本日はここまで。
今回は、千利休がなぜ切腹させられたのかについての
さまざまな議論を見てきたが、
いかがだっただろうか？",締め,1,
解説者,"2ちゃんねるの歴史オタクたちの議論を見ていると、
天下人に意見できるほどの力を持った文化人だったからこそ、
利休は危険視され、消されたのではないかと思えた。",締め,2,
解説者,"そして、その最期すらも切腹だったのか追放だったのか、
今なお謎に包まれているのである。",締め,3,
解説者,"今回の動画について他の意見や
感想があったらぜひコメントで教えてね！",締め,4,
解説者,"他にも歴史にまつわる情報をまとめた
動画が満載なので、ぜひ見てみてくださいね。
ご視聴ありがとうございました！",締め,5,
